{
  "$schema": "../../schemas/Credential-Format.json",
  "Credential Format": "CESR/CESR Proof",
  "Specification": "https://www.ietf.org/archive/id/draft-pfeairheller-cesr-proof-00.html",
  "Standardization (Body, Process)": "IETF (intention to go to Blockchain WG)",
  "Crypto Agility": true,
  "Selective Disclosure": true
}
