{
  "$schema": "../../schemas/Credential-Format.json",
  "Credential Format": "MDOC",
  "Implementation Support (e.g. Libraries) / Active Community": "Apple, Idemia, Thales, HID global, GET Group, Google, Panasonic, Spruce",
  "Specification": "ISO 18013-5",
  "Standardization (Body, Process)": "ISO",
  "Encoding Scheme": "CBOR",
  "Rich Schemas/Semantic": false,
  "Crypto Agility": true,
  "Selective Disclosure": {
    "Value": true,
    "Description": "salted hashes"
  },
  "Predicates": false,
  "Compatibility with Signing Algorithms": "ECDSA(NIST and Brainpool curves), EdDSA, RSA"
}
